{
  "schemaVersion": "scada.resident-source-declaration.v1",
  "sourceId": "SRC-KALEIDOS-STANDIN-001",
  "displayName": "Public-safe Kaleidos resident source stand-ins",
  "lifecycle": "resident",
  "syntheticStatus": "public-safe-standin",
  "ingest": {
    "topic": "scada.telemetry.v1",
    "endpointKind": "gateway-http"
  },
  "tags": [
    { "tagId": "TAG-KAL-01-FLUX-LOW", "assetId": "KAL-01-CORE", "signalKind": "flux", "unit": "relative-flux", "valueBasis": "measured" },
    { "tagId": "TAG-KAL-01-FLUX-MID", "assetId": "KAL-01-CORE", "signalKind": "flux", "unit": "relative-flux", "valueBasis": "measured" },
    { "tagId": "TAG-KAL-01-FLUX-HIGH", "assetId": "KAL-01-CORE", "signalKind": "flux", "unit": "relative-flux", "valueBasis": "measured" },
    { "tagId": "TAG-KAL-01-FLUX-RADIAL-N", "assetId": "KAL-01-CORE", "signalKind": "flux", "unit": "relative-flux", "valueBasis": "measured" },
    { "tagId": "TAG-KAL-01-FLUX-RADIAL-S", "assetId": "KAL-01-CORE", "signalKind": "flux", "unit": "relative-flux", "valueBasis": "measured" },
    { "tagId": "TAG-KAL-01-HELIUM-INLET", "assetId": "KAL-01-PRIMARY-LOOP", "signalKind": "temperature", "unit": "degC", "valueBasis": "measured" },
    { "tagId": "TAG-KAL-01-HELIUM-OUTLET", "assetId": "KAL-01-PRIMARY-LOOP", "signalKind": "temperature", "unit": "degC", "valueBasis": "measured" },
    { "tagId": "TAG-KAL-01-PRIMARY-PRESSURE", "assetId": "KAL-01-PRIMARY-LOOP", "signalKind": "pressure", "unit": "MPa", "valueBasis": "measured" },
    { "tagId": "TAG-KAL-01-HELIUM-FLOW", "assetId": "KAL-01-CIRCULATORS", "signalKind": "flow", "unit": "kg/s", "valueBasis": "measured" },
    { "tagId": "TAG-KAL-01-DRUM-POSITION", "assetId": "KAL-01-CONTROL-DRUMS", "signalKind": "actuatorState", "unit": "percent", "valueBasis": "measured" },
    { "tagId": "TAG-KAL-01-HX-HOT", "assetId": "KAL-01-HEAT-EXCHANGERS", "signalKind": "temperature", "unit": "degC", "valueBasis": "measured" },
    { "tagId": "TAG-KAL-01-HX-COLD", "assetId": "KAL-01-HEAT-EXCHANGERS", "signalKind": "temperature", "unit": "degC", "valueBasis": "measured" },
    { "tagId": "TAG-KAL-01-BOUNDARY-TEMP", "assetId": "KAL-01-CONTAINER-BOUNDARY", "signalKind": "temperature", "unit": "degC", "valueBasis": "measured" },
    { "tagId": "TAG-KAL-01-ELECTRIC-OUTPUT", "assetId": "KAL-01-POWER-CONVERSION", "signalKind": "electricalState", "unit": "MWe", "valueBasis": "measured" },
    { "tagId": "TAG-KAL-01-THERMAL-OUTPUT", "assetId": "KAL-01-SECONDARY-HEAT-USE", "signalKind": "flow", "unit": "MWt", "valueBasis": "measured" },
    { "tagId": "TAG-KAL-02-ELECTRIC-OUTPUT", "assetId": "KAL-02-POWER-CONVERSION", "signalKind": "electricalState", "unit": "MWe", "valueBasis": "measured" },
    { "tagId": "TAG-KAL-02-THERMAL-OUTPUT", "assetId": "KAL-02-SECONDARY-HEAT-USE", "signalKind": "flow", "unit": "MWt", "valueBasis": "measured" },
    { "tagId": "TAG-KAL-03-ELECTRIC-OUTPUT", "assetId": "KAL-03-POWER-CONVERSION", "signalKind": "electricalState", "unit": "MWe", "valueBasis": "measured" },
    { "tagId": "TAG-KAL-03-THERMAL-OUTPUT", "assetId": "KAL-03-SECONDARY-HEAT-USE", "signalKind": "flow", "unit": "MWt", "valueBasis": "measured" },
    { "tagId": "TAG-KAL-04-BOUNDARY-TEMP", "assetId": "KAL-04-CONTAINER-BOUNDARY", "signalKind": "temperature", "unit": "degC", "valueBasis": "measured" },
    { "tagId": "TAG-KAL-04-RESIDUAL-HEAT", "assetId": "KAL-04-VESSEL", "signalKind": "flow", "unit": "MWth", "valueBasis": "measured" },
    { "tagId": "TAG-KAL-05-BREAKER-STATE", "assetId": "KAL-05-POWER-CONVERSION", "signalKind": "electricalState", "unit": "state", "valueBasis": "measured" }
  ]
}
